Sr. No.,Topic,SubTopic,Question,Option A,Option B,Option C,Option D,Correct Answer,Difficulty Level,Score
1,Rise Up,Optimised Operations,What is the first step in the Standard Process of Optimization?,Definition of the scope,Analysis process,Identification,Streamlining process,A,Easy,1
2,Rise Up,Optimised Operations,Which of the following is a benefit of identifying patterns in processes?,Time-saving,Increased complexity,Reduced efficiency,Unpredictable outcomes,A,Easy,1
3,Rise Up,Optimised Operations,What is the last step in the Standard Process of Optimization?,Forecasting,Communication,Implementation,Monitoring,D,Easy,1
4,Rise Up,Optimised Operations,What is the key factor to consider when assessing the impact on other interlinked processes?,Positive effects,Negative effects,Efficiency improvement,Holistic perspective,B,Easy,1
5,Rise Up,Optimised Operations,Why is it crucial for startups to carry out the optimization process during the early-stage planning?,To eliminate inefficient parts,To increase complexity,To delay efficiency improvements,To reduce overall efficiency,A,Easy,1
6,Rise Up,Optimised Operations,What is the common pattern in the recruitment process according to the author?,"Common entrance test, interview, HR round","Interview, HR round, common entrance test","HR round, common entrance test, interview","Streamlining process, forecasting, communication",A,Medium,2
7,Rise Up,Optimised Operations,Which step involves designing an efficient Standard Operating Procedure (SOP) around the process?,Definition of the scope,Analysis process,Identification,Implementation,D,Medium,2
8,Rise Up,Optimised Operations,What is the purpose of the Analysis process in the Standard Process of Optimization?,To forecast outcomes,To identify patterns,To streamline processes,To analyze the scope,B,Medium,2
9,Rise Up,Optimised Operations,How does the identification of patterns benefit organizations?,It allows for making small changes to get maximum results,It increases complexity,It reduces efficiency,It hinders the optimization process,A,Medium,2
10,Rise Up,Optimised Operations,What is the significance of the streamlining process in the Standard Process of Optimization?,It helps eliminate inefficiencies,It complicates the process,It delays efficiency improvements,It reduces overall efficiency,A,Medium,2
11,Rise Up,Optimised Operations,Why is it important to assess the impact on other interlinked processes during optimization?,To forecast the possible impact,To eliminate problematic areas,To streamline the existing process,To prioritize identified focus areas,A,Medium,2
12,Rise Up,Optimised Operations,Which step involves enhancing the overall efficiency of the organization?,Forecasting,Communication,Implementation,Monitoring,C,Medium,2
13,Rise Up,Optimised Operations,How does the identification of patterns lead to efficiency improvement?,By making small changes to optimize the pattern,By increasing complexity,By reducing efficiency,By delaying the optimization process,A,Hard,3
14,Rise Up,Optimised Operations,What is the advantage of designing an efficient Standard Operating Procedure (SOP) around the process?,It saves time wasted on repetitive tasks,It increases complexity,It reduces efficiency,It hinders the optimization process,A,Hard,3
15,Rise Up,Optimised Operations,What is the key benefit of carrying out optimization processes at regular intervals?,Enhancing the overall efficiency of the organization,Increasing complexity,Reducing efficiency,Delaying efficiency improvements,A,Hard,3
16,Rise Up,Optimised Operations,What is the crucial step for startups during the early-stage planning?,Carrying out the optimization process,Increasing complexity,Reducing efficiency,Delaying efficiency improvements,A,Hard,3
17,Rise Up,Optimised Operations,What is the primary purpose of conducting brainstorming sessions with domain experts and Think Tanks?,Identifying the problem,Assessing the impact,Resolving problematic areas,Coming up with effective solutions,D,Medium,2
18,Rise Up,Optimised Operations,Why is forecasting the impact crucial during the analysis of proposed changes?,To streamline the existing process,To assess the impact on other processes,To prioritize identified focus areas,To conduct brainstorming sessions,B,Hard,3
19,Rise Up,Optimised Operations,What is the significance of prioritizing identified focus areas in the optimization process?,Identifying repetitive areas,Assessing the impact,Resolving problematic areas,Conducting brainstorming sessions,C,Hard,3
